{
  "schema_version": "asi_stack.deliberation_admission_fixture.v0",
  "scope": "synthetic_deliberation_record_routing_only",
  "cases": [
    {"id": "valid_high_risk_to_planning", "record": {"request_recorded": true, "high_risk_request": true, "think_budget_recorded": true, "search_mode_recorded": true, "verifier_scope_recorded": true, "independent_verifier_recorded": true, "candidate_history_recorded": true, "stop_condition_recorded": true, "residual_owner_recorded": true, "trace_authority_separated": true, "budget_exhausted": false, "execution_requested": true}, "expected_route": "release_to_planning"},
    {"id": "invalid_missing_budget_record", "record": {"request_recorded": true, "high_risk_request": true, "think_budget_recorded": false, "search_mode_recorded": true, "verifier_scope_recorded": true, "independent_verifier_recorded": true, "candidate_history_recorded": true, "stop_condition_recorded": true, "residual_owner_recorded": true, "trace_authority_separated": true, "budget_exhausted": false, "execution_requested": true}, "expected_route": "require_independent_review"},
    {"id": "invalid_missing_search_mode", "record": {"request_recorded": true, "high_risk_request": true, "think_budget_recorded": true, "search_mode_recorded": false, "verifier_scope_recorded": true, "independent_verifier_recorded": true, "candidate_history_recorded": true, "stop_condition_recorded": true, "residual_owner_recorded": true, "trace_authority_separated": true, "budget_exhausted": false, "execution_requested": true}, "expected_route": "require_independent_review"},
    {"id": "invalid_missing_verifier_scope", "record": {"request_recorded": true, "high_risk_request": true, "think_budget_recorded": true, "search_mode_recorded": true, "verifier_scope_recorded": false, "independent_verifier_recorded": true, "candidate_history_recorded": true, "stop_condition_recorded": true, "residual_owner_recorded": true, "trace_authority_separated": true, "budget_exhausted": false, "execution_requested": true}, "expected_route": "require_independent_review"},
    {"id": "invalid_missing_candidate_history", "record": {"request_recorded": true, "high_risk_request": true, "think_budget_recorded": true, "search_mode_recorded": true, "verifier_scope_recorded": true, "independent_verifier_recorded": true, "candidate_history_recorded": false, "stop_condition_recorded": true, "residual_owner_recorded": true, "trace_authority_separated": true, "budget_exhausted": false, "execution_requested": true}, "expected_route": "require_independent_review"},
    {"id": "invalid_missing_stop_condition", "record": {"request_recorded": true, "high_risk_request": true, "think_budget_recorded": true, "search_mode_recorded": true, "verifier_scope_recorded": true, "independent_verifier_recorded": true, "candidate_history_recorded": true, "stop_condition_recorded": false, "residual_owner_recorded": true, "trace_authority_separated": true, "budget_exhausted": false, "execution_requested": true}, "expected_route": "require_independent_review"},
    {"id": "invalid_missing_residual_owner", "record": {"request_recorded": true, "high_risk_request": true, "think_budget_recorded": true, "search_mode_recorded": true, "verifier_scope_recorded": true, "independent_verifier_recorded": true, "candidate_history_recorded": true, "stop_condition_recorded": true, "residual_owner_recorded": false, "trace_authority_separated": true, "budget_exhausted": false, "execution_requested": true}, "expected_route": "require_independent_review"},
    {"id": "invalid_trace_authority_laundering", "record": {"request_recorded": true, "high_risk_request": true, "think_budget_recorded": true, "search_mode_recorded": true, "verifier_scope_recorded": true, "independent_verifier_recorded": true, "candidate_history_recorded": true, "stop_condition_recorded": true, "residual_owner_recorded": true, "trace_authority_separated": false, "budget_exhausted": false, "execution_requested": true}, "expected_route": "require_independent_review"},
    {"id": "invalid_budget_exhausted", "record": {"request_recorded": true, "high_risk_request": true, "think_budget_recorded": true, "search_mode_recorded": true, "verifier_scope_recorded": true, "independent_verifier_recorded": true, "candidate_history_recorded": true, "stop_condition_recorded": true, "residual_owner_recorded": true, "trace_authority_separated": true, "budget_exhausted": true, "execution_requested": true}, "expected_route": "stop_and_escrow_residual"},
    {"id": "invalid_high_risk_missing_independent_verifier", "record": {"request_recorded": true, "high_risk_request": true, "think_budget_recorded": true, "search_mode_recorded": true, "verifier_scope_recorded": true, "independent_verifier_recorded": false, "candidate_history_recorded": true, "stop_condition_recorded": true, "residual_owner_recorded": true, "trace_authority_separated": true, "budget_exhausted": false, "execution_requested": true}, "expected_route": "require_independent_review"}
  ],
  "support_state_effect": "none",
  "known_extra_compute_harms_preserved": 15,
  "non_claims": ["No language-model candidate ran in this fixture.", "No independent evaluator was implemented here.", "No reasoning-quality or trace-faithfulness result is established.", "No test-time-compute benefit or efficiency is established.", "No execution authority, safety, model quality, or deployment result is established.", "No AGI, ASI, or support-state movement is established."]
}
